### ISSUE TITLE
TCP port reuse problem

### ISSUE THREAD

**Issue by justinc1** [cloudius-systems/osv#889]
I have problem running wrk in VM1 against nginx in VM0. nginx will close persisten HTTP conection after 100 GET requests, and then wrk has to reconnect. Frequently, the reconnect fails - wrk sends syn, but syn-ack from server is missing, and wrk than just waits. After requested test period elapses, wrk reports that multiple of 100 number of requests - so this is at least easy to spot. If wrk is asked to run long enough, say 10 instead of only 1 sec, it does retransmit SYN, but server still doesn't respond.

Initially, I could only reproduce problem if:
 - server VM0 was started and left running
 - client/wrk VM1 was rebooted after test.

Looking trough tcpdump files for a while, I narrowed problem down to tcp port reuse. For example:
```
# server VM0 with IP 192.168.122.90
/bin/cp build/debug/usr.img vm0.img; ./scripts/run.py -i vm0.img --novnc -Vnv -e '/cli/cli.so & /tools/nginx.so -c /usr/local/nginx/conf/nginx.conf'
# client VM1 with IP 192.168.122.91
/bin/cp build/debug/usr.img vm1.img; ./scripts/run.py -i vm1.img --novnc -Vnv --gdb 1235 --mac 52:54:00:12:34:57 -m 15G -e '/cli/cli.so' | tee aa

# repeat this 4 times, log IP traffic into wrk-13a.pcap
curl -m1 -X POST http://192.168.122.91:8000/os/reboot & sleep 0.1 ; curl http://192.168.122.90:8000/os/version; curl http://192.168.122.91:8000/os/version; sleep 0.1; curl -X PUT http://192.168.122.91:8000/app/?command="$(rawurlencode "/wrk -t1 -c1 -d10 http://192.168.122.90:80/index.html")"\&new_program=1

# in 4 attempts, I got:
  63527 requests in 9.99s, 51.49MB read
  63461 requests in 9.99s, 51.44MB read
  22100 requests in 10.00s, 17.91MB read
  1500 requests in 10.00s, 1.22MB read
```

The 6000 req/s rate in first two trials is ok, the 22100 and 1500 requests are not.
The failed 1500 requests look like:

```
tcpdump -nnr wrk-13a.pcap | cat -n
 310070 22:32:13.347583 IP 192.168.122.91.47507 > 192.168.122.90.80: Flags [P.], seq 5195:5248, ack 83301, win 1040, options [nop,nop,TS val 1575 ecr 1546109572], length 53: HTTP: GET /index.html HTTP/1.1
 310071 22:32:13.347705 IP 192.168.122.90.80 > 192.168.122.91.47507: Flags [P.], seq 83301:84151, ack 5248, win 1040, options [nop,nop,TS val 1546109572 ecr 1575], length 850: HTTP: HTTP/1.1 200 OK
 310072 22:32:13.347762 IP 192.168.122.91.47507 > 192.168.122.90.80: Flags [P.], seq 5248:5301, ack 84151, win 1040, options [nop,nop,TS val 1575 ecr 1546109572], length 53: HTTP: GET /index.html HTTP/1.1
 310073 22:32:13.347890 IP 192.168.122.90.80 > 192.168.122.91.47507: Flags [FP.], seq 84151:84996, ack 5301, win 1040, options [nop,nop,TS val 1546109572 ecr 1575], length 845: HTTP: HTTP/1.1 200 OK
 310074 22:32:13.347939 IP 192.168.122.91.47507 > 192.168.122.90.80: Flags [.], ack 84997, win 1027, options [nop,nop,TS val 1575 ecr 1546109572], length 0
 310075 22:32:13.347942 IP 192.168.122.91.47507 > 192.168.122.90.80: Flags [F.], seq 5301, ack 84997, win 1040, options [nop,nop,TS val 1575 ecr 1546109572], length 0
 #
 310076 22:32:13.347953 IP 192.168.122.91.13261 > 192.168.122.90.80: Flags [S], seq 966734008, win 65535, options [mss 1460,nop,wscale 6,sackOK,TS val 1575 ecr 0], length 0
 310077 22:32:13.347996 IP 192.168.122.90.80 > 192.168.122.91.47507: Flags [.], ack 5302, win 1040, options [nop,nop,TS val 1546109573 ecr 1575], length 0
 #
 310078 22:32:16.348001 IP 192.168.122.91.13261 > 192.168.122.90.80: Flags [S], seq 966734008, win 65535, options [mss 1460,nop,wscale 6,sackOK,TS val 4575 ecr 0], length 0
 310079 22:32:19.548023 IP 192.168.122.91.13261 > 192.168.122.90.80: Flags [S], seq 966734008, win 65535, options [mss 1460,nop,wscale 6,sackOK,TS val 7775 ecr 0], length 0
 310080 22:32:22.748078 IP 192.168.122.91.13261 > 192.168.122.90.80: Flags [S], seq 966734008, win 65535, options [mss 1460,sackOK,eol], length 0
 310081 22:32:31.923670 IP 192.168.122.90.80 > 192.168.122.91.65383: Flags [F.], seq 1, ack 2, win 1040, options [nop,nop,TS val 1131145985 ecr 181], length 0
 310082 22:32:32.153687 IP 192.168.122.90.80 > 192.168.122.91.65383: Flags [F.], seq 1, ack 2, win 1040, options [nop,nop,TS val 1131146215 ecr 181], length 0
 310083 22:32:32.413736 IP 192.168.122.90.80 > 192.168.122.91.65383: Flags [F.], seq 1, ack 2, win 1040, options [nop,nop,TS val 1131146475 ecr 181], length 0
 310084 22:32:32.733745 IP 192.168.122.90.80 > 192.168.122.91.65383: Flags [F.], seq 1, ack 2, win 1040, options [nop,nop,TS val 1131146795 ecr 181], length 0
```

SYN from port 13261 is dropped by server. It was already used before, in one of previous 3 VMs:
```
119632	22:31:42.149271 IP 192.168.122.91.13261 > 192.168.122.90.80: Flags [S], seq 2844048132, win 65535, options [mss 1460,nop,wscale 6,sackOK,TS val 10407 ecr 0], length 0
119634	22:31:42.149321 IP 192.168.122.90.80 > 192.168.122.91.13261: Flags [S.], seq 2378270565, ack 2844048133, win 65535, options [mss 1460,nop,wscale 6,sackOK,TS val 2899447642 ecr 10407], length 0
...
119834	22:31:42.164280 IP 192.168.122.91.13261 > 192.168.122.90.80: Flags [P.], seq 5248:5301, ack 84151, win 1040, options [nop,nop,TS val 10422 ecr 2899447657], length 53: HTTP: GET /index.html HTTP/1.1
119835	22:31:42.164406 IP 192.168.122.90.80 > 192.168.122.91.13261: Flags [FP.], seq 84151:84996, ack 5301, win 1040, options [nop,nop,TS val 2899447657 ecr 10422], length 845: HTTP: HTTP/1.1 200 OK
119836	22:31:42.164426 IP 192.168.122.91.13261 > 192.168.122.90.80: Flags [.], ack 84997, win 1027, options [nop,nop,TS val 10422 ecr 2899447657], length 0
119837	22:31:42.164431 IP 192.168.122.91.13261 > 192.168.122.90.80: Flags [F.], seq 5301, ack 84997, win 1040, options [nop,nop,TS val 10422 ecr 2899447657], length 0
119839	22:31:42.164473 IP 192.168.122.90.80 > 192.168.122.91.13261: Flags [.], ack 5302, win 1040, options [nop,nop,TS val 2899447657 ecr 10422], length 0
...
310076	22:32:13.347953 IP 192.168.122.91.13261 > 192.168.122.90.80: Flags [S], seq 966734008, win 65535, options [mss 1460,nop,wscale 6,sackOK,TS val 1575 ecr 0], length 0
310078	22:32:16.348001 IP 192.168.122.91.13261 > 192.168.122.90.80: Flags [S], seq 966734008, win 65535, options [mss 1460,nop,wscale 6,sackOK,TS val 4575 ecr 0], length 0
310079	22:32:19.548023 IP 192.168.122.91.13261 > 192.168.122.90.80: Flags [S], seq 966734008, win 65535, options [mss 1460,nop,wscale 6,sackOK,TS val 7775 ecr 0], length 0
310080	22:32:22.748078 IP 192.168.122.91.13261 > 192.168.122.90.80: Flags [S], seq 966734008, win 65535, options [mss 1460,sackOK,eol], length 0
```

So client VM was not able to reuse port after 31 sec. I guess that might even be correct, if connection is in FIN_WAIT/FIN_WAIT2 state (or whatever is called the 'very last' tcp state).

But there were also other port reuse cases, were new connection did succeeded.
```
grep reused wireshark.out 
 139477 15.274387      192.168.122.91        192.168.122.90        13098  80     TCP      74     [TCP Port numbers reused] 13098 → 80 [SYN] Seq=0 Win=65535 Len=0 MSS=1460 WS=64 SACK_PERM=1 TSval=1959 TSecr=0
   conn established, 8 sec since previous connection
 306978 31.057428      192.168.122.91        192.168.122.90        19029  80     TCP      74     [TCP Port numbers reused] 19029 → 80 [SYN] Seq=0 Win=65535 Len=0 MSS=1460 WS=64 SACK_PERM=1 TSval=4826 TSecr=0
   conn failed, 17 sec since previous connection
 309046 41.350732      192.168.122.91        192.168.122.90        18999  80     TCP      74     [TCP Port numbers reused] 18999 → 80 [SYN] Seq=0 Win=65535 Len=0 MSS=1460 WS=64 SACK_PERM=1 TSval=1501 TSecr=0
   conn established, 11 sec since previous connection
 310076 41.424538      192.168.122.91        192.168.122.90        13261  80     TCP      74     [TCP Port numbers reused] 13261 → 80 [SYN] Seq=0 Win=65535 Len=0 MSS=1460 WS=64 SACK_PERM=1 TSval=1575 TSecr=0
   conn failed, 31 sec since previous connection
```

Based on those 4 cases, I initially thought that maybe port can be reused, if say 0-11 sec elapsed from previous use, and cannot if 17-31 sec elapsed. After some reading, I doubt this is the case. More likely, if port is reused, then the client sequence number should be higher that that from the old conn. I read something like that "somewhere"; I will try to look after the reference. And to check the absolute seq/ack num in the pcap file. I can also upload the pcap file.

**Comment by justinc1** [comment]
Test case (which fails) is at https://groups.google.com/forum/#!topic/osv-dev/uTF5X82_hfI. It uses a single VM, not two. If there is large enough delay between reconnect attempts (say 1 sec, static constexpr int DELAY_ITER = 1000*1000;), then it passes.

**Comment by justinc1** [comment]
The previous 4 port reused cases, now with abs seq/ack numbers.
  
```
86064	7.680764	192.168.122.90	192.168.122.91	80	13098	TCP	74	80 → 13098 [SYN, ACK] Seq=1501270247 Ack=2165149293 Win=65535 Len=0 MSS=1460 WS=64 SACK_PERM=1 TSval=4061656045 TSecr=7862
...
86269	7.696421	192.168.122.90	192.168.122.91	80	13098	TCP	66	80 → 13098 [ACK] Seq=1501355244 Ack=2165154594 Win=66560 Len=0 TSval=4061656060 TSecr=7877
...
139477	15.274387	192.168.122.91	192.168.122.90	13098	80	TCP	74	[TCP Port numbers reused] 13098 → 80 [SYN] Seq=2231768386 Win=65535 Len=0 MSS=1460 WS=64 SACK_PERM=1 TSval=1959 TSecr=0
139477 15.274387      192.168.122.91        192.168.122.90        13098  80     TCP      74     [TCP Port numbers reused] 13098 → 80 [SYN] Seq=0 Win=65535 Len=0 MSS=1460 WS=64 SACK_PERM=1 TSval=1959 TSecr=0
conn established, 8 sec since previous connection
Seq=1501355244 Ack=2165154594
Seq=2231768386
new  Seq=2231768386 > old Ack=2165154594


133917	14.869951	192.168.122.90	192.168.122.91	80	19029	TCP	74	80 → 19029 [SYN, ACK] Seq=365146863 Ack=1132383824 Win=65535 Len=0 MSS=1460 WS=64 SACK_PERM=1 TSval=3357279816 TSecr=1555
...
134122	14.884204	192.168.122.90	192.168.122.91	80	19029	TCP	66	80 → 19029 [ACK] Seq=365231860 Ack=1132389125 Win=66560 Len=0 TSval=3357279830 TSecr=1569
...
306978	31.057428	192.168.122.91	192.168.122.90	19029	80	TCP	74	[TCP Port numbers reused] 19029 → 80 [SYN] Seq=1118779824 Win=65535 Len=0 MSS=1460 WS=64 SACK_PERM=1 TSval=4826 TSecr=0
306978 31.057428      192.168.122.91        192.168.122.90        19029  80     TCP      74     [TCP Port numbers reused] 19029 → 80 [SYN] Seq=0 Win=65535 Len=0 MSS=1460 WS=64 SACK_PERM=1 TSval=4826 TSecr=0
conn failed, 17 sec since previous connection
Seq=365231860 Ack=1132389125
Seq=1118779824
new seq 1118779824 < old seq 1132389125


300823	30.577012	192.168.122.90	192.168.122.91	80	18999	TCP	74	80 → 18999 [SYN, ACK] Seq=1310181601 Ack=23640841 Win=65535 Len=0 MSS=1460 WS=64 SACK_PERM=1 TSval=4078373211 TSecr=4346
...
301028	30.591664	192.168.122.90	192.168.122.91	80	18999	TCP	66	80 → 18999 [ACK] Seq=1310266598 Ack=23646142 Win=66560 Len=0 TSval=4078373226 TSecr=4360
...
309046	41.350732	192.168.122.91	192.168.122.90	18999	80	TCP	74	[TCP Port numbers reused] 18999 → 80 [SYN] Seq=1553793820 Win=65535 Len=0 MSS=1460 WS=64 SACK_PERM=1 TSval=1501 TSecr=0
309046 41.350732      192.168.122.91        192.168.122.90        18999  80     TCP      74     [TCP Port numbers reused] 18999 → 80 [SYN] Seq=0 Win=65535 Len=0 MSS=1460 WS=64 SACK_PERM=1 TSval=1501 TSecr=0
...
309253	41.365551	192.168.122.90	192.168.122.91	80	18999	TCP	66	80 → 18999 [ACK] Seq=1060083566 Ack=1553799122 Win=66560 Len=0 TSval=3686742555 TSecr=1516
conn established, 11 sec since previous connection
Seq=1310266598 Ack=23646142 
Seq=1553793820
new seq 1553793820 > old seq 23646142


119634	10.225906	192.168.122.90	192.168.122.91	80	13261	TCP	74	80 → 13261 [SYN, ACK] Seq=2378270565 Ack=2844048133 Win=65535 Len=0 MSS=1460 WS=64 SACK_PERM=1 TSval=2899447642 TSecr=10407
...
119839	10.241058	192.168.122.90	192.168.122.91	80	13261	TCP	66	80 → 13261 [ACK] Seq=2378355562 Ack=2844053434 Win=66560 Len=0 TSval=2899447657 TSecr=10422
...
310076	41.424538	192.168.122.91	192.168.122.90	13261	80	TCP	74	[TCP Port numbers reused] 13261 → 80 [SYN] Seq=966734008 Win=65535 Len=0 MSS=1460 WS=64 SACK_PERM=1 TSval=1575 TSecr=0
310076 41.424538      192.168.122.91        192.168.122.90        13261  80     TCP      74     [TCP Port numbers reused] 13261 → 80 [SYN] Seq=0 Win=65535 Len=0 MSS=1460 WS=64 SACK_PERM=1 TSval=1575 TSecr=0
conn failed, 31 sec since previous connection
Seq=2378355562 Ack=2844053434
Seq=966734008
new seq 966734008 < old seq 2844053434
```

When new seq (e.g. for the to be established conn) > old seq (e.g. from the old, already terminated conn), new conn works. If new seq < old seq, then second connection failed.

I believe this is correct behavior on server side. From http://blog.davidvassallo.me/2010/07/13/time_wait-and-port-reuse/:
```
The RFC, anticipating (or reacting to) this problem, states:

“When a connection is closed actively, it MUST linger in TIME-WAIT state for a time 2xMSL (Maximum Segment Lifetime). However, it MAY accept a new SYN from the remote TCP to reopen the connection directly from TIME-WAIT state, if it:

(1)  assigns its initial sequence number for the new connection to be larger than the largest sequence number it used on the previous connection incarnation, and

(2)  returns to TIME-WAIT state if the SYN turns out to be an old duplicate”
```
So with new ack < old ack, TCP stack should not open a new conn (or, more precisely, re-establish the old conn).

It would be interesting to check if failing tests/tst-tcp-port-reuse.cc has the same problem (but I need to modified it first, to use 2 VMs, so that tcpdump can acquire data; or maybe, I should use scripts/trace.py - there is some tcpdump-like functionality).

One significant difference between nginx/wrk 2 VM test and tst-tcp-port-reuse.cc single VM test. I understand that wrk on VM1, after reboot, cannot know that the same client IP:PORT used particular acq number before. But in single VM test, I believe the tcp stack _should_ autoselect higher initial seq number for the second conn. So the tst-tcp-port-reuse.cc should not fail.

**Comment by justinc1** [comment]
Taking look at packet when running test program on linux (only initial syn  and syn+ack from each connection):
```
g++ -g -pthread -std=c++11 tests/tst-tcp-port-reuse.cc && time ./a.out 
sudo tcpdump -nni any port 1234 or port 5000 | cat -n
     1	12:41:53.173380 IP 127.0.0.1.5000 > 127.0.0.1.1234: Flags [S], seq 1495072833, win 43690, options [mss 65495,sackOK,TS val 13246559 ecr 0,nop,wscale 7], length 0
     2	11:45:38.351669 IP 127.0.0.1.1234 > 127.0.0.1.5000: Flags [S.], seq 3997098239, ack 1495072834, win 43690, options [mss 65495,sackOK,TS val 13246559 ecr 13246559,nop,wscale 7], length 0

    11	12:41:53.173641 IP 127.0.0.1.5000 > 127.0.0.1.1234: Flags [S], seq 1495077355, win 43690, options [mss 65495,sackOK,TS val 13246559 ecr 0,nop,wscale 7], length 0
    12	11:45:38.351669 IP 127.0.0.1.1234 > 127.0.0.1.5000: Flags [S.], seq 3997164078, ack 1495077356, win 43690, options [mss 65495,sackOK,TS val 13246559 ecr 13246559,nop,wscale 7], length 0

    21	12:41:53.174006 IP 127.0.0.1.5000 > 127.0.0.1.1234: Flags [S], seq 1495082928, win 43690, options [mss 65495,sackOK,TS val 13246560 ecr 0,nop,wscale 7], length 0
    22	11:45:42.646637 IP 127.0.0.1.1234 > 127.0.0.1.5000: Flags [S.], seq 3997229917, ack 1495082929, win 43690, options [mss 65495,sackOK,TS val 13246560 ecr 13246560,nop,wscale 7], length 0

    31	12:41:53.174301 IP 127.0.0.1.5000 > 127.0.0.1.1234: Flags [S], seq 1495087654, win 43690, options [mss 65495,sackOK,TS val 13246560 ecr 0,nop,wscale 7], length 0
    32	11:45:42.646637 IP 127.0.0.1.1234 > 127.0.0.1.5000: Flags [S.], seq 3997295756, ack 1495087655, win 43690, options [mss 65495,sackOK,TS val 13246560 ecr 13246560,nop,wscale 7], length 0
```

So Linux ensures that new ack is > old ack.

**Comment by justinc1** [comment]
I'm curios (but I haven't read RFC yet) - is it legal if server replies with RST when new seq < old seq? At least, client could immediately try to reconnect.

**Comment by justinc1** [comment]
I tried to figure out the correct behaviour by looking at what linux does. I had nc server listening in VM, and nc client run on host. tcpdump recorded traffic, and tcpreplay than generated new syn packet with new seq == old seq (only first packet was replayed). The VM didn't respond with any packet at all. I didn't try to change any setting on /proc /sys etc (I don't even know if there is any relevant setting at all).

So it seems, OSv behaviour wot regard to silently ignoring invalid SYN packets is correct (or at least, it is equivalent to what linux does). Not exactly behaviour I would like to see, as it means that even VM (hard) reboot is problematic.

The test case sent to osv-dev still shows problem in TCP implementation. It should pass on both Linux and OSv.
