### ISSUE TITLE
ssh in defalt image is not functioning

### ISSUE THREAD

**Issue by vladzcloudius** [cloudius-systems/osv#458]
master HEAD: 8a0c751c44857216ceff82569041972a3d858c9d + 'empty could-init/cmdline (as a workaround to issue #457'
Build command: `make`
Loading OSv with the following command: `sudo scripts/run.py -nv -c1 -m4G`
Running the following ssh command: `ssh -v admin@192.168.122.89`

The ssh session stucks after the following step:
debug1: Offering DSA public key: /home/<my user>/.ssh/id_dsa

We see with the sniffer that the last thing OSv does is sending the "GET /2012-01-12/meta-data/public-keys/ HTTP/1.1\r\n" request to 169.254.169.254. All this server does it just sends TCP ACKs to us:
|Time              | 192.168.122.89                        |
|                     |                   | 169.254.169.254   |
|1.915572000|         61479 > http [SYN]            |TCP: 61479 > http [SYN] Seq=2486278331 
|                     |(61479)  ------------------>  (80)     |
|1.933248000|         http > 61479 [SYN,            |TCP: http > 61479 [SYN, ACK] Seq=1297653237 
|                     |(61479)  <------------------  (80)     |
|1.933340000|         61479 > http [ACK]            |TCP: 61479 > http [ACK] Seq=2486278332 
|                     |(61479)  ------------------>  (80)     |
|1.934811000|         GET /2012-01-12/met           |HTTP: GET /2012-01-12/meta-data/public-keys/ HTTP/1.1
|         |(61479)  ------------------>  (80)     |
|1.952765000|         http > 61479 [ACK]            |TCP: http > 61479 [ACK] Seq=1297653238 
|         |(61479)  <------------------  (80)     |

After the last ACK above we keep waiting until 169.254.169.254 evetually send us a RST and we start the session (the same as above) against it again.

As a result an ssh session after a REALLY long time gets disconnected with
`Received disconnect from 192.168.122.89: 2: User authentication has timed out`
(While a user hasn't had a chance to enter a password).

**Comment by nyh** [comment]
I'm closing this issue. crsh is no longer part of the default image.
