### ISSUE TITLE
Running OSv memached on Xen

### ISSUE THREAD

**Issue by Jeongseob** [cloudius-systems/osv#602]
Hi all,

Currently, I am experiencing the OSv memcached on my Xen host. I have used the image from the public repository (http://downloads.osv.io.s3.amazonaws.com/cloudius/osv-memcached-opt/osv-memcached-opt-v0.18.qemu.qcow2). 

In my environment, the provided qcow2 image does not work. So, I tried to change the image type to raw format. It works well, but it seems like there are some errors. I attached my screen shot. When I also test the iperf image, i did not see any errors. Is there anyone who experience like this problem?

![osv-memcached_on_xen](https://cloud.githubusercontent.com/assets/4322991/6782804/b1bf5d1e-d14c-11e4-87e0-d477467fe080.png)

**Comment by dorlaor** [comment]
On Mon, Mar 23, 2015 at 5:06 PM, Jeongseob Ahn <notifications@github.com>
wrote:

> Hi all,
>
> Currently, I am experiencing the OSv memcached on my Xen host. I have used
> the image from the public repository (
> http://downloads.osv.io.s3.amazonaws.com/cloudius/osv-memcached-opt/osv-memcached-opt-v0.18.qemu.qcow2).
>
>
> In my environment, the provided qcow2 image does not work. So, I tried to
> change the image type to raw format. It works well, but it seems like there
> are some errors. I attached my screen shot. When I also test the iperf
> image, i did not see any errors. Is there anyone who experience like this
> problem?
>

The previous output is logical so I think the image is fine.
Can you tcpdump the packets you see on the bridge? The IP address is a bit
unusual (not
that it should be a problem). I just tested the kvm image using Capstan and
it worked fine.

**Comment by Jeongseob** [comment]
Thank Dor Laor. As I know, the default setting is DHCP. So, it received the public IP from my department. I also think it does not matter. 

Anyway, could you let me know how to tcpdump the packets? I do not know the way and If I can tcpdump the packets, could you tell me what I have to check?

**Comment by dorlaor** [comment]
On Mon, Mar 23, 2015 at 5:34 PM, Jeongseob Ahn <notifications@github.com>
wrote:

> Thank Dor Laor. As I know, the default setting is DHCP. So, it received
> the public IP from my department. I also think it does not matter.
>
> Anyway, could you let me know how to tcpdump the packets? I do not know
> the way and If I can tcpdump the packets, could you tell me what I have to
> check?
>
You can run tcpdump -i BRIDGE_NAME to get the packets that the guest is
hooked on.
Do you manage to ping the guest?
What happens when you send memcache packets to it (UDP only)?

**Comment by Jeongseob** [comment]
When I ping the guest, it works well. 

$] ping 141.212.106.107
PING 141.212.106.107 (141.212.106.107) 56(84) bytes of data.
64 bytes from 141.212.106.107: icmp_req=1 ttl=64 time=0.181 ms
64 bytes from 141.212.106.107: icmp_req=2 ttl=64 time=0.235 ms
64 bytes from 141.212.106.107: icmp_req=3 ttl=64 time=0.205 ms
64 bytes from 141.212.106.107: icmp_req=4 ttl=64 time=0.199 ms

And I ran tcpdump like below.

# brctl show
bridge name	bridge id		STP enabled	interfaces
xenbr0		8000.fcaa143fe4c4	no		eth0
						                	vif22.0

# tcpdump -i vif22.0
tcpdump: WARNING: vif22.0: no IPv4 address assigned
tcpdump: verbose output suppressed, use -v or -vv for full protocol decode
listening on vif22.0, link-type EN10MB (Ethernet), capture size 65535 bytes
12:19:52.672230 IP6 fe80::1403:a90e:3908:4100.dhcpv6-client > ff02::1:2.dhcpv6-server: dhcp6 solicit
12:19:52.698553 IP6 fe80::7646:a0ff:fe9f:fda9.mdns > ff02::fb.mdns: 0 PTR (QM)? 9.228.239.115.in-addr.arpa. (44)
12:19:52.698614 IP ironninja.eecs.umich.edu.mdns > 224.0.0.251.mdns: 0 PTR (QM)? 9.228.239.115.in-addr.arpa. (44)
12:19:52.701103 IP 224.0.0.251.mdns > ironninja.eecs.umich.edu.mdns: 0 [17746n] [21071au][|domain]
12:19:52.710696 IP vlsilab-17.eecs.umich.edu.netbios-ns > 141.212.106.255.netbios-ns: NBT UDP PACKET(137): QUERY; REQUEST; BROADCAST
12:19:52.718506 STP 802.1w, Rapid STP, Flags [Learn, Forward], bridge-id 2105.f8:66:f2:28:fd:00.8051, length 43
12:19:52.803770 IP6 fe80::fcff:ffff:feff:ffff.mdns > ff02::fb.mdns: 0 PTR (QM)? 251.0.0.224.in-addr.arpa. (42)
12:19:52.803862 IP6 fe80::feaa:14ff:fe3f:e4c4.mdns > ff02::fb.mdns: 0 PTR (QM)? 251.0.0.224.in-addr.arpa. (42)
12:19:52.803970 IP ahn.eecs.umich.edu.mdns > 224.0.0.251.mdns: 0 PTR (QM)? 251.0.0.224.in-addr.arpa. (42)
12:19:52.806335 IP 224.0.0.251.mdns > ahn.eecs.umich.edu.mdns: 0 [17746n] [21071au][|domain]
12:19:52.921648 IP vlsilab-04.eecs.umich.edu.netbios-ns > 141.212.106.255.netbios-ns: NBT UDP PACKET(137): QUERY; REQUEST; BROADCAST
^C12:19:52.975468 ARP, Request who-has 2003priv.eecs.umich.edu tell 141.212.106.1, length 46


Finally, when I run the memcached client which is from CloudSuite, it cannot connect to the server.

**Comment by dorlaor** [comment]
On Mon, Mar 23, 2015 at 6:20 PM, Jeongseob Ahn <notifications@github.com>
wrote:

> When I ping the guest, it works well.
>
> $] ping 141.212.106.107
> PING 141.212.106.107 (141.212.106.107) 56(84) bytes of data.
> 64 bytes from 141.212.106.107: icmp_req=1 ttl=64 time=0.181 ms
> 64 bytes from 141.212.106.107: icmp_req=2 ttl=64 time=0.235 ms
> 64 bytes from 141.212.106.107: icmp_req=3 ttl=64 time=0.205 ms
> 64 bytes from 141.212.106.107: icmp_req=4 ttl=64 time=0.199 ms
>
> And I ran tcpdump like below.
> brctl show
>
> bridge name bridge id STP enabled interfaces
> xenbr0 8000.fcaa143fe4c4 no eth0
> vif22.0
> tcpdump -i vif22.0
>
> tcpdump: WARNING: vif22.0: no IPv4 address assigned
> tcpdump: verbose output suppressed, use -v or -vv for full protocol decode
> listening on vif22.0, link-type EN10MB (Ethernet), capture size 65535 bytes
> 12:19:52.672230 IP6 fe80::1403:a90e:3908:4100.dhcpv6-client >
> ff02::1:2.dhcpv6-server: dhcp6 solicit
> 12:19:52.698553 IP6 fe80::7646:a0ff:fe9f:fda9.mdns > ff02::fb.mdns: 0 PTR
> (QM)? 9.228.239.115.in-addr.arpa. (44)
> 12:19:52.698614 IP ironninja.eecs.umich.edu.mdns > 224.0.0.251.mdns: 0 PTR
> (QM)? 9.228.239.115.in-addr.arpa. (44)
> 12:19:52.701103 IP 224.0.0.251.mdns > ironninja.eecs.umich.edu.mdns: 0
> [17746n] [21071au][|domain]
> 12:19:52.710696 IP vlsilab-17.eecs.umich.edu.netbios-ns >
> 141.212.106.255.netbios-ns: NBT UDP PACKET(137): QUERY; REQUEST; BROADCAST
> 12:19:52.718506 STP 802.1w, Rapid STP, Flags [Learn, Forward], bridge-id
> 2105.f8:66:f2:28:fd:00.8051, length 43
> 12:19:52.803770 IP6 fe80::fcff:ffff:feff:ffff.mdns > ff02::fb.mdns: 0 PTR
> (QM)? 251.0.0.224.in-addr.arpa. (42)
> 12:19:52.803862 IP6 fe80::feaa:14ff:fe3f:e4c4.mdns > ff02::fb.mdns: 0 PTR
> (QM)? 251.0.0.224.in-addr.arpa. (42)
> 12:19:52.803970 IP ahn.eecs.umich.edu.mdns > 224.0.0.251.mdns: 0 PTR (QM)?
> 251.0.0.224.in-addr.arpa. (42)
> 12:19:52.806335 IP 224.0.0.251.mdns > ahn.eecs.umich.edu.mdns: 0 [17746n]
> [21071au][|domain]
> 12:19:52.921648 IP vlsilab-04.eecs.umich.edu.netbios-ns >
> 141.212.106.255.netbios-ns: NBT UDP PACKET(137): QUERY; REQUEST; BROADCAST
> ^C12:19:52.975468 ARP, Request who-has 2003priv.eecs.umich.edu tell
> 141.212.106.1, length 46
>

With my human eyes I don't see something wrong here. Note that usually it's
not ideal to
have the software bridge with STP on (spanning tree), but that shouldn't
affect anything.

> Finally, when I run the memcached client which is from CloudSuite, it
> cannot connect to the server.
>
Are you using UDP mode? I don't know what's CloudSuite is but in case it's
compatible with
the text protocol it should work. You can check the osv-memcache code
yourself, it's pretty simple (and hacky):
https://github.com/vladzcloudius/osv-memcached

If you need a professional memcache, please use our seastar memcache
instead.
