### ISSUE TITLE
SSL handshake hangs when connecting to OSv on GCE

### ISSUE THREAD

**Issue by tgrabiec** [cloudius-systems/osv#372]
I've noticed that I am not able to establish an SSL connection from my laptop to OSv running on GCE. When OSv ran on my laptop all is fine. I've also noticed that I _am_ able to connect just fine from another GCE instance using either local or external IP.

Tracing packets [1] going through OSv instance revealed this:

```
14:38:19.196617 IP TOMEK.52012 > OSV.8443: Flags [.], ack 1, win 237, options [nop,nop,TS val 62762835 ecr 476581432,nop,nop,sack 1 {1449:1894}], length 0
14:38:19.468375 IP truncated-ip - 1386 bytes missing! OSV.8443 > TOMEK.52012: Flags [.], seq 1:1449, ack 179, win 1040, options [nop,nop,TS val 476581772 ecr 62762835], length 1448

14:38:19.468517 IP 10.240.0.1 > OSV: ICMP TOMEK unreachable - need to frag (mtu 1460), length 36
14:38:19.878408 IP truncated-ip - 1386 bytes missing! OSV.8443 > TOMEK.52012: Flags [.], seq 1:1449, ack 179, win 1040, options [nop,nop,TS val 476582182 ecr 62762835], length 1448
14:38:19.878555 IP 10.240.0.1 > OSV: ICMP TOMEK unreachable - need to frag (mtu 1460), length 36
14:38:20.501236 IP truncated-ip - 1386 bytes missing! OSV.8443 > TOMEK.52012: Flags [.], seq 1:1449, ack 179, win 1040, options [nop,nop,TS val 476582805 ecr 62762835], length 1448
14:38:20.501394 IP 10.240.0.1 > OSV: ICMP TOMEK unreachable - need to frag (mtu 1460), length 36
14:38:21.541253 IP truncated-ip - 1386 bytes missing! OSV.8443 > TOMEK.52012: Flags [.], seq 1:1449, ack 179, win 1040, options [nop,nop,TS val 476583845 ecr 62762835], length 1448
14:38:21.541391 IP 10.240.0.1 > OSV: ICMP TOMEK unreachable - need to frag (mtu 1460), length 36
14:38:23.421284 IP truncated-ip - 1386 bytes missing! OSV.8443 > TOMEK.52012: Flags [.], seq 1:1449, ack 179, win 1040, options [nop,nop,TS val 476585725 ecr 62762835], length 1448
14:38:23.421427 IP 10.240.0.1 > OSV: ICMP TOMEK unreachable - need to frag (mtu 1460), length 36

```

Looks like the frame we want to send (1448+14=1462) is too large (>1460) and some router is asking OSv to fragment but we ignore his request. I'm digging deeper into this...

[1] https://github.com/cloudius-systems/osv/wiki/Trace-analysis-using-trace.py#tracing-network-layer
