### ISSUE TITLE
nfs establish very slow more than 10s

### ISSUE THREAD

**Issue by yuwang888** [cloudius-systems/osv#941]
nfs server:
#cat /etc/exports
 /var/nfsshare/ *(rw,async,no_subtree_check,no_root_squash,insecure,sec=sys)
#touch /var/nfsshare/a

osv nfs client:
-e "/tools/mount-nfs.so nfs://192.168.122.1/var/nfsshare?uid=0 /bbb &cli"
after more than 10s, can see the file /bbb/a

below is the tcpdump log,16:24:11 mount nfs, but 16:24:31 can write/read file from host
listening on tap0, link-type EN10MB (Ethernet), capture size 65535 bytes
16:24:11.884979 STP 802.1d, Config, Flags [Topology change], bridge-id 8000.52:54:00:3c:e9:7e.8002, length 35
16:24:13.884977 STP 802.1d, Config, Flags [Topology change], bridge-id 8000.52:54:00:3c:e9:7e.8002, length 35
16:24:15.884978 STP 802.1d, Config, Flags [Topology change], bridge-id 8000.52:54:00:3c:e9:7e.8002, length 35
16:24:17.884977 STP 802.1d, Config, Flags [Topology change], bridge-id 8000.52:54:00:3c:e9:7e.8002, length 35
16:24:19.884976 STP 802.1d, Config, Flags [Topology change], bridge-id 8000.52:54:00:3c:e9:7e.8002, length 35
16:24:21.884978 STP 802.1d, Config, Flags [Topology change], bridge-id 8000.52:54:00:3c:e9:7e.8002, length 35
16:24:23.884979 STP 802.1d, Config, Flags [Topology change], bridge-id 8000.52:54:00:3c:e9:7e.8002, length 35
16:24:25.884979 STP 802.1d, Config, Flags [Topology change], bridge-id 8000.52:54:00:3c:e9:7e.8002, length 35
16:24:27.884977 STP 802.1d, Config, Flags [Topology change], bridge-id 8000.52:54:00:3c:e9:7e.8002, length 35
16:24:29.884980 STP 802.1d, Config, Flags [Topology change], bridge-id 8000.52:54:00:3c:e9:7e.8002, length 35
16:24:31.056169 ARP, Request who-has 192.168.122.1 tell 192.168.122.15, length 28
16:24:31.056202 ARP, Reply 192.168.122.1 is-at 52:54:00:3c:e9:7e (oui Unknown), length 28
16:24:31.056287 IP 192.168.122.15.53744 > 192.168.122.1.sunrpc: Flags [S], seq 3677288320, win 65535, options [mss 1460,sackOK,eol], length 0
16:24:31.056322 IP 192.168.122.1.sunrpc > 192.168.122.15.53744: Flags [S.], seq 195529961, ack 3677288321, win 29200, options [mss 1460,nop,nop,sackOK], length 0
16:24:31.056389 IP 192.168.122.15.53744 > 192.168.122.1.sunrpc: Flags [.], ack 1, win 65535, length 0
16:24:31.056422 IP 192.168.122.15.53744 > 192.168.122.1.sunrpc: Flags [P.], seq 1:73, ack 1, win 65535, length 72
16:24:31.056436 IP 192.168.122.1.sunrpc > 192.168.122.15.53744: Flags [.], ack 73, win 29200, length 0
16:24:31.056566 IP 192.168.122.1.sunrpc > 192.168.122.15.53744: Flags [P.], seq 1:29, ack 73, win 29200, length 28
16:24:31.056624 IP 192.168.122.15.53744 > 192.168.122.1.sunrpc: Flags [P.], seq 73:161, ack 29, win 65535, length 88

**Comment by nyh** [comment]
From the tcpdump (thanks!) it doesn't seem like the NFS mount is taking 10 seconds - is started in 16:24:31.056169 (with the ARP request) and ended in 16:24:31.056624 - that's half a millisecond (!).

What seems (?) to be taking 10 or more seconds is the setup of the bridged networking in your host. I don't know what you have set up there and why it's so slow, and why we see so many STP messages, but you should probably look into that. I don't think this is an NFS bug, and not even an OSv bug.

**Comment by yuwang888** [comment]
@nyh thanks for your reply,
yes, i found if only use 
-e "   --ip=eth0,192.168.122.15,255.255.255.0 --defaultgw=192.168.122.1 --nameserver=192.168.122.1 --console=serial /cli/cli.so  "
after osv boot, host can ping osv(192.168.122.15) immediately,
but if i add nfs mount 
-e "   --ip=eth0,192.168.122.15,255.255.255.0 --defaultgw=192.168.122.1 --nameserver=192.168.122.1 --console=serial /cli/cli.so&/tools/mount-nfs.so nfs://192.168.122.1/var/nfsshare?uid=0 /bbb  "
host can ping osv after 10s

**Comment by yuwang888** [comment]
@nyh thanks for your reply,
yes, i found if only use 
-e "   --ip=eth0,192.168.122.15,255.255.255.0 --defaultgw=192.168.122.1 --nameserver=192.168.122.1 --console=serial /cli/cli.so  "
after osv boot, host can ping osv(192.168.122.15) immediately,
but if i add nfs mount 
-e "   --ip=eth0,192.168.122.15,255.255.255.0 --defaultgw=192.168.122.1 --nameserver=192.168.122.1 --console=serial /cli/cli.so&/tools/mount-nfs.so nfs://192.168.122.1/var/nfsshare?uid=0 /bbb  "
host can ping osv after 10s

**Comment by nyh** [comment]
If "host can ping osv after 10s", it again seems like some problem with the network setup, not NFS, because how does running the NFS client delay ping? Note that we get an IP address, and start answering pings, before even starting to run the application (including the NFS mount).
That being said, if it's consistent - running mount-nfs.so always changes causes the 10s delay, not running it doesn't, then I guess mount-nfs.so does influence something... But I have no guess what....

**Comment by yuwang888** [comment]
@nyh , in your environment, is it ok?

**Comment by yuwang888** [comment]
@nyh  use delay=3 when boot, and i can see all the tcpdump log,
it sames as arp first '192.168.122.1' not reply
14:57:48.660855 ARP, Request who-has 192.168.122.15 tell 192.168.122.15, length 28
14:57:48.773232 ARP, Request who-has 192.168.122.1 tell 192.168.122.15, length 28
14:57:50.066318 STP 802.1d, Config, Flags [Topology change], bridge-id 8000.52:54:00:3c:e9:7e.8002, length 35
14:57:52.066325 STP 802.1d, Config, Flags [Topology change], bridge-id 8000.52:54:00:3c:e9:7e.8002, length 35
14:57:54.066319 STP 802.1d, Config, Flags [Topology change], bridge-id 8000.52:54:00:3c:e9:7e.8002, length 35
14:57:56.066321 STP 802.1d, Config, Flags [Topology change], bridge-id 8000.52:54:00:3c:e9:7e.8002, length 35
14:57:58.066314 STP 802.1d, Config, Flags [Topology change], bridge-id 8000.52:54:00:3c:e9:7e.8002, length 35
14:58:00.066316 STP 802.1d, Config, Flags [Topology change], bridge-id 8000.52:54:00:3c:e9:7e.8002, length 35
14:58:02.066323 STP 802.1d, Config, Flags [Topology change], bridge-id 8000.52:54:00:3c:e9:7e.8002, length 35
14:58:04.066322 STP 802.1d, Config, Flags [Topology change], bridge-id 8000.52:54:00:3c:e9:7e.8002, length 35








14:58:06.066324 STP 802.1d, Config, Flags [Topology change], bridge-id 8000.52:54:00:3c:e9:7e.8002, length 35
14:58:08.066318 STP 802.1d, Config, Flags [Topology change], bridge-id 8000.52:54:00:3c:e9:7e.8002, length 35
14:58:10.066336 STP 802.1d, Config, Flags [Topology change], bridge-id 8000.52:54:00:3c:e9:7e.8002, length 35
14:58:10.773050 ARP, Request who-has 192.168.122.1 tell 192.168.122.15, length 28
14:58:10.773076 ARP, Reply 192.168.122.1 is-at 52:54:00:3c:e9:7e (oui Unknown), length 28

**Comment by yuwang888** [comment]
@nyh i modify the arp timeout arpt_down from 20 to 1, i found nfs mount success within 1s;
so i think first arp request, the network is not ready, to arp timeout to retry,
and how to fix it? or how to config the nfs booting

**Comment by yuwang888** [comment]
@nyh use run.py with -v, it is ok, so maybe the different between tap,id=hn%d,script=scripts/qemu-ifup.sh and bridge,id=hn%d,br=%s,helper=%s
this issue closed

**Comment by nyh** [comment]
I think maybe you closed this issue prematurely, so I'm reopening. I am not sure this is a bug per se, but it is at best a bad feature ;-) I think what may be happening is this:

1. The qemu bridge-helper thing (which I'm no expert on...) is taking some time - even if just 100ms - to set up and the VM cannot reach the other hosts on the bridge during boot.
2. You are not using DHCP, so the first use of the network is your NFS mount attempt.
3. NFS uses UDP, not TCP (right?) so it may send many packets before receiving any reply (I'm guessing here).
4. *Every* one of these packets will send out an ARP request. A comment in if_ether.c suggests only one request is sent per second, but I don't see code actually doing this!
5. After arp_maxtries, 5 by default, ARP requests, that all happened (according to my theory) in the first few milliseconds of the run - and were not yet answered - the code in if_ether.c marks it *down* in the arp table.
6. When an address is marked "down" "in the arp table, the code waits for arpt_down, which as you noticed is 20 seconds, before ever making another ARP request.
7. I also wonder if it's a good idea that arp_maxhold==1. Isn't this like Linux's /proc/sys/net/ipv4/neigh/default/unres_qlen which defaults to 101 (not 3 as arp(7) suggests)? This can cause, even after ARP is finally resolved, to force NFS to retransmit packets. But this is less critical, I guess.

Can you try to confirm that this is really what is happening? If you could add a printout in arpresolve() (in if_ether.c) saying when (at what time) it is called, you can check if my suspicion - that it is called 5 times in quick succession. Also please add a printout  just before the "if (la->la_asked < V_arp_maxtries)" code to see it is actually reached those 5 times.

If this is really the problem, we'll need to think of a fix. One possibility might be to rate limit the arp requests (I don't know if 1 per second or some other number) as the comment already suggests it does, so that "5 retries" is actually a reasonable amount of time for the bridge to reconfigure and not 1ms. I think Linux does this too, with its retrans_time_ms (see arp(7)) which defaults to 1000 ms.

A simpler workaround/solution is what you did, reduce aprt_down to, say, 1 second, as you did. This will still hang for a full second even if less would have sufficed, but the solution above also has the same problem (another ARP request would not be send before the 1 second timeout has passed). The downside is that if a node is *really* down and our host continues to send it packets, we'll continue to send ARP broadcasts at a maximum of 5 times ever second - instead of 5 times every 20 seconds. Of course, any decent network protocol  would not continue to send packets to a non-existant host for a long time, so I don't think this is a big problem.
