### ISSUE TITLE
TCP retransmission with 'net: use rcu_hashtable in net channel classifier'

### ISSUE THREAD

**Issue by asias** [cloudius-systems/osv#378]
With this patch I saw TCP retransmission in netperf tcp_cc test. If I
revert it, the retransmission is gone.

$ netperf -H 192.168.2.53 -t TCP_CC -l -10 --  -D

$ tshark -i bridge2 -f tcp -n
....

 62   0.001600 192.168.2.53 -> 192.168.2.2  TCP 74 29529 > 38891 [SYN,
ACK] Seq=0 Ack=1 Win=65535 Len=0 MSS=1460 WS=64 SACK_PERM=1
TSval=2391786859 TSecr=180854341
 63   0.001606  192.168.2.2 -> 192.168.2.53 TCP 66 38891 > 29529 [ACK]
Seq=1 Ack=1 Win=29696 Len=0 TSval=180854341 TSecr=2391786859
 64   0.001631 192.168.2.53 -> 192.168.2.2  TCP 66 29529 > 38891 [FIN,
ACK] Seq=1 Ack=1 Win=66560 Len=0 TSval=2391786859 TSecr=180854341
 65   0.001645 192.168.2.53 -> 192.168.2.2  TCP 722 12865 > 19146
[PSH, ACK] Seq=657 Ack=657 Win=66560 Len=656 TSval=3938271066
TSecr=180854340
 66   0.001645  192.168.2.2 -> 192.168.2.53 TCP 66 38891 > 29529 [FIN,
ACK] Seq=1 Ack=2 Win=29696 Len=0 TSval=180854341 TSecr=2391786859
 67   0.001649  192.168.2.2 -> 192.168.2.53 TCP 66 19146 > 12865 [ACK]
Seq=657 Ack=1313 Win=32256 Len=0 TSval=180854341 TSecr=3938271066
 68   0.001670 192.168.2.53 -> 192.168.2.2  TCP 66 29529 > 38891 [ACK]
Seq=2 Ack=2 Win=66560 Len=0 TSval=2391786859 TSecr=180854341
 69   0.001707  192.168.2.2 -> 192.168.2.53 TCP 66 19146 > 12865 [FIN,
ACK] Seq=657 Ack=1313 Win=32256 Len=0 TSval=180854341 TSecr=3938271066
 70   0.001745 192.168.2.53 -> 192.168.2.2  TCP 66 12865 > 19146 [ACK]
Seq=1313 Ack=658 Win=66560 Len=0 TSval=3938271066 TSecr=180854341
 71   0.001751 192.168.2.53 -> 192.168.2.2  TCP 66 12865 > 19146 [FIN,
ACK] Seq=1313 Ack=658 Win=66560 Len=0 TSval=3938271066 TSecr=180854341
 72   0.001755  192.168.2.2 -> 192.168.2.53 TCP 66 19146 > 12865 [ACK]
Seq=658 Ack=1314 Win=32256 Len=0 TSval=180854341 TSecr=3938271066
 73   0.231808 192.168.2.53 -> 192.168.2.2  TCP 66 [TCP
Retransmission] 12865 > 19146 [FIN, ACK] Seq=1313 Ack=658 Win=66560
Len=0 TSval=3938271296 TSecr=180854341
 74   0.231826  192.168.2.2 -> 192.168.2.53 TCP 66 [TCP Dup ACK 72#1]
19146 > 12865 [ACK] Seq=658 Ack=1314 Win=32256 Len=0 TSval=180854572
TSecr=3938271066
 75   0.491875 192.168.2.53 -> 192.168.2.2  TCP 66 [TCP
Retransmission] 12865 > 19146 [FIN, ACK] Seq=1313 Ack=658 Win=66560
Len=0 TSval=3938271556 TSecr=180854341
75  76   0.491890  192.168.2.2 -> 192.168.2.53 TCP 66 [TCP Dup ACK
72#2] 19146 > 12865 [ACK] Seq=658 Ack=1314 Win=32256 Len=0
TSval=180854832 TSecr=3938271066
 77   0.811943 192.168.2.53 -> 192.168.2.2  TCP 66 [TCP
Retransmission] 12865 > 19146 [FIN, ACK] Seq=1313 Ack=658 Win=66560
Len=0 TSval=3938271877 TSecr=180854341
77  78   0.811958  192.168.2.2 -> 192.168.2.53 TCP 66 [TCP Dup ACK
72#3] 19146 > 12865 [ACK] Seq=658 Ack=1314 Win=32256 Len=0
TSval=180855152 TSecr=3938271066
 79   1.252050 192.168.2.53 -> 192.168.2.2  TCP 66 [TCP
Retransmission] 12865 > 19146 [FIN, ACK] Seq=1313 Ack=658 Win=66560
Len=0 TSval=3938272317 TSecr=180854341
 80   1.252064  192.168.2.2 -> 192.168.2.53 TCP 66 [TCP Dup ACK 72#4]
19146 > 12865 [ACK] Seq=658 Ack=1314 Win=32256 Len=0 TSval=180855592
TSecr=3938271066
80  81   1.932084 192.168.2.53 -> 192.168.2.2  TCP 66 [TCP
Retransmission] 12865 > 19146 [FIN, ACK] Seq=1313 Ack=658 Win=66560
Len=0 TSval=3938272997 TSecr=180854341
81  82   1.932099  192.168.2.2 -> 192.168.2.53 TCP 66 [TCP Dup ACK
72#5] 19146 > 12865 [ACK] Seq=658 Ack=1314 Win=32256 Len=0
TSval=180856272 TSecr=3938271066
82  83   3.092163 192.168.2.53 -> 192.168.2.2  TCP 66 [TCP
Retransmission] 12865 > 19146 [FIN, ACK] Seq=1313 Ack=658 Win=66560
Len=0 TSval=3938274157 TSecr=180854341
 84   3.092178  192.168.2.2 -> 192.168.2.53 TCP 66 [TCP Dup ACK 72#6]
19146 > 12865 [ACK] Seq=658 Ack=1314 Win=32256 Len=0 TSval=180857432
TSecr=3938271066
84  85   5.212248 192.168.2.53 -> 192.168.2.2  TCP 66 [TCP
Retransmission] 12865 > 19146 [FIN, ACK] Seq=1313 Ack=658 Win=66560
Len=0 TSval=3938276277 TSecr=180854341
 86   5.212264  192.168.2.2 -> 192.168.2.53 TCP 66 [TCP Dup ACK 72#7]
19146 > 12865 [ACK] Seq=658 Ack=1314 Win=32256 Len=0 TSval=180859552
TSecr=3938271066
86  87   9.252328 192.168.2.53 -> 192.168.2.2  TCP 66 [TCP
Retransmission] 12865 > 19146 [FIN, ACK] Seq=1313 Ack=658 Win=66560
Len=0 TSval=3938280317 TSecr=180854341
 88   9.252366  192.168.2.2 -> 192.168.2.53 TCP 66 [TCP Dup ACK 72#8]
19146 > 12865 [ACK] Seq=658 Ack=1314 Win=32256 Len=0 TSval=180863592
TSecr=3938271066
88  89  17.132414 192.168.2.53 -> 192.168.2.2  TCP 66 [TCP
Retransmission] 12865 > 19146 [FIN, ACK] Seq=1313 Ack=658 Win=66560
Len=0 TSval=3938288197 TSecr=180854341
 90  17.132437  192.168.2.2 -> 192.168.2.53 TCP 66 [TCP Dup ACK 72#9]
19146 > 12865 [ACK] Seq=658 Ack=1314 Win=32256 Len=0 TSval=180871472
TSecr=3938271066
